{
  "$schema": "https://json-schema.org/draft/2020-12/schema",
  "$id": "https://example.org/schemas/compliance_control_mapping.schema.json",
  "title": "Compliance Control Mapping",
  "type": "object",
  "required": ["version", "canonical_domains", "controls", "jurisdiction_overlays", "systemic_risk_triggers"],
  "properties": {
    "version": {"type": "string", "pattern": "^[0-9]+\\.[0-9]+\\.[0-9]+$"},
    "canonical_domains": {
      "type": "array",
      "minItems": 8,
      "items": {"type": "string", "pattern": "^[A-Z]+$"},
      "uniqueItems": true
    },
    "controls": {
      "type": "array",
      "minItems": 5,
      "items": {
        "type": "object",
        "required": [
          "control_id",
          "domain",
          "title",
          "implementation_owner",
          "mapped_frameworks",
          "minimum_evidence",
          "automated_tests"
        ],
        "properties": {
          "control_id": {"type": "string", "pattern": "^[A-Z]+-[0-9]{3}$"},
          "domain": {"type": "string", "pattern": "^[A-Z]+$"},
          "title": {"type": "string", "minLength": 5},
          "implementation_owner": {"type": "string", "minLength": 3},
          "mapped_frameworks": {"type": "array", "minItems": 1, "items": {"type": "string"}},
          "minimum_evidence": {"type": "array", "minItems": 1, "items": {"type": "string"}},
          "automated_tests": {"type": "array", "minItems": 1, "items": {"type": "string"}}
        },
        "additionalProperties": false
      }
    },
    "jurisdiction_overlays": {
      "type": "object",
      "minProperties": 3,
      "additionalProperties": {
        "type": "array",
        "minItems": 1,
        "items": {"type": "string"}
      }
    },
    "systemic_risk_triggers": {
      "type": "object",
      "required": ["vendor_concentration_index", "severe_drift_events_per_quarter", "mtc_minutes"],
      "properties": {
        "vendor_concentration_index": {"$ref": "#/$defs/triggerThreshold"},
        "severe_drift_events_per_quarter": {"$ref": "#/$defs/triggerThreshold"},
        "mtc_minutes": {"$ref": "#/$defs/triggerThreshold"}
      },
      "additionalProperties": false
    }
  },
  "$defs": {
    "triggerThreshold": {
      "type": "object",
      "required": ["warning", "critical"],
      "properties": {
        "warning": {"type": "number"},
        "critical": {"type": "number"}
      },
      "additionalProperties": false
    }
  },
  "additionalProperties": false
}
