{
  "version": "2.0.0",
  "canonical_domains": ["GOV", "RISK", "DATA", "DEV", "VAL", "DEP", "OPS", "HUMAN", "SEC", "THIRD", "DISC", "AUDIT"],
  "controls": [
    {
      "control_id": "GOV-001",
      "domain": "GOV",
      "title": "AI governance charter and named accountability",
      "implementation_owner": "Chief AI Officer",
      "mapped_frameworks": ["EU_AI_ACT", "NIST_AI_RMF_1_0", "ISO_IEC_42001", "FCA_SMCR", "OECD_AI_PRINCIPLES"],
      "minimum_evidence": ["board_approval_record", "raci_matrix", "policy_version_log"],
      "automated_tests": ["policy_exists", "owner_assigned", "annual_review_within_sla"]
    },
    {
      "control_id": "RISK-003",
      "domain": "RISK",
      "title": "Risk tiering and use-case classification",
      "implementation_owner": "Model Risk Management",
      "mapped_frameworks": ["EU_AI_ACT", "NIST_AI_RMF_1_0", "NIST_AI_600_1", "BASEL_III_IV"],
      "minimum_evidence": ["risk_tier_registry", "materiality_assessment", "systemic_externality_score"],
      "automated_tests": ["risk_tier_present", "classification_approved", "tier_specific_controls_loaded"]
    },
    {
      "control_id": "VAL-007",
      "domain": "VAL",
      "title": "Independent validation and challenger testing",
      "implementation_owner": "Independent Validation Unit",
      "mapped_frameworks": ["SR_11_7", "EU_AI_ACT_ANNEX_IV", "NIST_AI_RMF_1_0", "BASEL_III_IV"],
      "minimum_evidence": ["validation_report", "challenger_results", "limitations_register", "approval_minutes"],
      "automated_tests": ["validation_status_pass", "independence_verified", "challenge_coverage_min_threshold"]
    },
    {
      "control_id": "HUMAN-003",
      "domain": "HUMAN",
      "title": "Human oversight, recourse, and contestability",
      "implementation_owner": "Business Line + Compliance",
      "mapped_frameworks": ["GDPR_ART_22", "FCRA_ECOA", "FCA_CONSUMER_DUTY", "MAS_HKMA_FEAT"],
      "minimum_evidence": ["reconsideration_workflow", "customer_notice_templates", "sla_metrics"],
      "automated_tests": ["human_override_path_exists", "contestation_path_exists", "sla_threshold_met"]
    },
    {
      "control_id": "SEC-010",
      "domain": "SEC",
      "title": "Runtime security and incident response",
      "implementation_owner": "CISO",
      "mapped_frameworks": ["NIS2", "EU_AI_ACT", "NIST_AI_RMF_1_0"],
      "minimum_evidence": ["siem_alert_linkage", "incident_playbooks", "kill_switch_test_results"],
      "automated_tests": ["mttd_within_threshold", "mttr_within_threshold", "kill_switch_weekly_test_pass"]
    },
    {
      "control_id": "THIRD-004",
      "domain": "THIRD",
      "title": "Third-party frontier model dependency governance",
      "implementation_owner": "Third-Party Risk Office",
      "mapped_frameworks": ["EU_AI_ACT", "BASEL_III_IV", "NIS2", "FCA_SMCR"],
      "minimum_evidence": ["vendor_concentration_assessment", "exit_plan", "substitutability_test"],
      "automated_tests": ["vendor_score_current", "concentration_below_limit", "exit_playbook_exists"]
    }
  ],
  "jurisdiction_overlays": {
    "EU_EEA": ["EU_AI_ACT", "GDPR", "NIS2"],
    "UK": ["FCA_CONSUMER_DUTY", "SMCR"],
    "US": ["FCRA", "ECOA", "SR_11_7", "BASEL_III_IV"],
    "SG_HK": ["MAS_FEAT", "HKMA_FEAT"]
  },
  "systemic_risk_triggers": {
    "vendor_concentration_index": {"warning": 0.25, "critical": 0.30},
    "severe_drift_events_per_quarter": {"warning": 1, "critical": 2},
    "mtc_minutes": {"warning": 15, "critical": 20}
  }
}
